Title,Type,Deadline,Region,Open To,Organiser,Contact US,Official Link,Tags
Employment-Based US Green Card Application || Apply Now,Internships,USA,All Nationalities,US Government
Apply to join The Assembly Creative Youth Advisory Council 2023,Internships Miscellaneous,"14 April,2023",Africa,All,The Assembly Hub
2023 World Health Organization Paid Internship in Switzerland,Internships,"08 April,2023",Switzerland,All Nationalities,World Health Organization
2023 World Food Programme Internship (US$1000 per month) in Italy,Internships,"03 April,2023",Italy,All Nationalities,World Food Programme,+39-06-65131
Paid Internship Opportunities In the USA for Master’s Students,Internships,Ongoing,USA,All Nationalities
Apply Now To Be UN Strategic & External Affairs Advisor 2023,Internships,"23 March,2023",UK,All,UN
FAOU Spring Internship Program 2023 | Funded,Internships,"30 March,2023",Estonia,All,Fatima Al-Fihri Open University,contact@alfihri.org
List of Internships in Japan for International Students,Internships,Ongoing,Japan,All Nationalities
2023 United Nations Internship in USA,Internships,"16 April,2023",USA,All Nationalities,UNited Nations
Moniepoint Tech Internship 2023 | Paid,Internships,"14 March,2023",Africa,All,Moniepoint
Wilson Center’s Middle East Program Internship 2023,Internships,"15 March,2023",USA,All,Wilson Center,mep@wilsoncenter.org
Paid Internships in Spain 2023 || Apply Now,Internships,Ongoing,Spain,All Nationalities
List of Paid Internships at Facebook,Internships,USA,All Nationalities
